{
  "Header": {
    "Value": {
      "Version": "D0",
      "TransactionCode": "B1",
      "RecordCount": 1,
      "Status": "A",
      "ServiceProviderIdQualifier": "01",
      "ServiceProviderId": "1234567890",
      "DateOfService": "20240115"
    }
  },
  "Message": {
    "Message": "PRESCRIPTION CLAIM APPROVED"
  },
  "Insurance": {
    "GroupId": "GRP001",
    "PlanId": "PLAN001",
    "CardholderId": "12345678901"
  },
  "Patient": {
    "FirstName": "JOHN",
    "LastName": "DOE",
    "BirthDate": "1980-05-15"
  },
  "Claims": [
    {
      "Status": {
        "ResponseStatusCode": "P",
        "AuthorizationNumber": "AUTH123456789",
        "RejectCodeCount": 0,
        "RejectCodes": [],
        "TransactionReferenceNumber": "TRN123456789"
      },
      "Claim": {
        "PrescriptionServiceReference": {
          "Qualifier": "1",
          "Number": "1234567890"
        }
      },
      "Pricing": {
        "PatientPayAmount": 10.0,
        "IngredientCostPaid": 90.0,
        "DispensingFeePaid": 2.5,
        "TotalAmountPaid": 92.5,
        "BasisOfReimbursementDetermination": 1,
        "CopayAmount": 10.0,
        "BasisOfCalculation": {
          "DispensingFee": "01",
          "Copay": "01"
        }
      }
    }
  ]
}
